publish_date,media_name,title,url,date,year,month,year_month,week,title_clean
2025-11-17,inquirer.com,EPA moves to limit scope of clean water law to reduce amount of wetlands it covers,https://www.inquirer.com/wires/ap/epa-moves-limit-scope-clean-water-law-reduce-amount-wetlands-it-covers-20251117.html,2025-11-17,2025,11,2025-11,2025-11-17/2025-11-23,EPA moves to limit scope of clean water law to reduce amount of wetlands it covers
2025-11-17,theconversation.com,COP30: Zambia’s forest communities need finance for solar power – so they don’t have to cut down trees to pay for it,https://theconversation.com/cop30-zambias-forest-communities-need-finance-for-solar-power-so-they-dont-have-to-cut-down-trees-to-pay-for-it-268494,2025-11-17,2025,11,2025-11,2025-11-17/2025-11-23,COP30: Zambia’s forest communities need finance for solar power – so they don’t have to cut down trees to pay for it
2025-11-17,reuters.com,"Tyson Foods to halt carbon emissions claims, environmental group says",https://www.reuters.com/sustainability/cop/tyson-foods-halt-carbon-emissions-claims-environmental-group-says-2025-11-17/,2025-11-17,2025,11,2025-11,2025-11-17/2025-11-23,"Tyson Foods to halt carbon emissions claims, environmental group says"
2025-11-17,realclearpolitics.com,Reality Caught Up to 'Climate Change',https://www.realclearpolitics.com/2025/11/17/reality_caught_up_to_climate_change_668338.html,2025-11-17,2025,11,2025-11,2025-11-17/2025-11-23,Reality Caught Up to 'Climate Change'
2025-11-17,theguardian.com,‘This is survival’: Jamaica leads calls from vulnerable nations at Cop30,https://www.theguardian.com/environment/2025/nov/17/this-is-survival-jamaica-leads-calls-from-vulnerable-nations-at-cop30,2025-11-17,2025,11,2025-11,2025-11-17/2025-11-23,‘This is survival’: Jamaica leads calls from vulnerable nations at Cop30
2025-11-17,theconversation.com,Renewable energy is cheaper and healthier – so why isn’t it replacing fossil fuels faster?,https://theconversation.com/renewable-energy-is-cheaper-and-healthier-so-why-isnt-it-replacing-fossil-fuels-faster-269685,2025-11-17,2025,11,2025-11,2025-11-17/2025-11-23,Renewable energy is cheaper and healthier – so why isn’t it replacing fossil fuels faster?
2025-11-17,theconversation.com,"Worries about climate change are waning in many well-off nations – but growing in Turkey, Brazil and India",https://theconversation.com/worries-about-climate-change-are-waning-in-many-well-off-nations-but-growing-in-turkey-brazil-and-india-269160,2025-11-17,2025,11,2025-11,2025-11-17/2025-11-23,"Worries about climate change are waning in many well-off nations – but growing in Turkey, Brazil and India"
2025-11-17,benzinga.com,Lithium Protests At COP30 Put Tesla And Albemarle Investors On Alert - Lithium Americas (NYSE:LAC),https://www.benzinga.com/news/esg/25/11/48906480/lithium-protests-at-cop30-put-tesla-albemarle-investors-on-alert?utm_source=benzinga_taxonomy&utm_medium=rss_feed_free&utm_content=taxonomy_rss&utm_campaign=channel,2025-11-17,2025,11,2025-11,2025-11-17/2025-11-23,Lithium Protests At COP30 Put Tesla And Albemarle Investors On Alert - Lithium Americas (NYSE:LAC)
2025-11-17,inquirer.com,UPDATE 1-COP30 delegates dig into toughest issues as climate talks enter final week,https://www.inquirer.com/wires/reuters/america-wire/update-1-cop30-delegates-dig-into-toughest-issues-climate-talks-enter-final-week-20251117.html,2025-11-17,2025,11,2025-11,2025-11-17/2025-11-23,UPDATE 1-COP30 delegates dig into toughest issues as climate talks enter final week
2025-11-17,thenation.com,Indigenous Activists to COP30: “We Will Fight to the Death”,https://www.thenation.com/article/environment/belem-cop30-indigenous-protests/,2025-11-17,2025,11,2025-11,2025-11-17/2025-11-23,Indigenous Activists to COP30: “We Will Fight to the Death”
2025-11-17,theguardian.com,Business and energy leaders warn Coalition dumping net zero won’t cut power bills and demand more detail,https://www.theguardian.com/australia-news/2025/nov/18/business-and-energy-leaders-warn-coalition-dumping-net-zero-wont-cut-power-bills-and-demand-more-detail,2025-11-17,2025,11,2025-11,2025-11-17/2025-11-23,Business and energy leaders warn Coalition dumping net zero won’t cut power bills and demand more detail
2025-11-17,theguardian.com,‘Damned if we do but completely stuffed if we don’t’: heatwaves will worsen longer net zero is delayed,https://www.theguardian.com/environment/2025/nov/17/heatwaves-hotter-longer-more-frequent-net-zero-emisisons-delay,2025-11-17,2025,11,2025-11,2025-11-17/2025-11-23,‘Damned if we do but completely stuffed if we don’t’: heatwaves will worsen longer net zero is delayed
2025-11-17,bostonglobe.com,Higher-ranking ministers take charge at COP30 as pressure mounts for urgent climate action,https://www.bostonglobe.com/2025/11/17/world/un-climate-talks-government-ministers/,2025-11-17,2025,11,2025-11,2025-11-17/2025-11-23,Higher-ranking ministers take charge at COP30 as pressure mounts for urgent climate action
2025-11-17,inquirer.com,"FEATURE-With more heat and storms, can COP30 boost frontline resilience?",https://www.inquirer.com/wires/reuters/america-wire/feature-with-more-heat-storms-can-cop30-boost-frontline-resilience-20251117.html,2025-11-17,2025,11,2025-11,2025-11-17/2025-11-23,"FEATURE-With more heat and storms, can COP30 boost frontline resilience?"
2025-11-17,jsonline.com,"What Wisconsin can learn from UN climate summit, COP30",https://www.jsonline.com/story/opinion/2025/11/17/milwaukee-un-climate-summit-cop-30-paris-agreement-plastic/87272312007/,2025-11-17,2025,11,2025-11,2025-11-17/2025-11-23,"What Wisconsin can learn from UN climate summit, COP30"
2025-11-17,reuters.com,"Despite few CEOs, hopes are high that COP30 will bring business into the fold of climate action",https://www.reuters.com/sustainability/climate-energy/despite-few-ceos-hopes-are-high-that-cop30-will-bring-business-into-fold-climate--ecmii-2025-11-17/,2025-11-17,2025,11,2025-11,2025-11-17/2025-11-23,"Despite few CEOs, hopes are high that COP30 will bring business into the fold of climate action"
2025-11-17,inquirer.com,"FEATURE-At COP30, Brazil's farmers defend record on forests",https://www.inquirer.com/wires/reuters/america-wire/feature-at-cop30-brazils-farmers-defend-record-forests-20251117.html,2025-11-17,2025,11,2025-11,2025-11-17/2025-11-23,"FEATURE-At COP30, Brazil's farmers defend record on forests"
2025-11-17,courant.com,Higher-ranking ministers take charge at COP30 as pressure mounts for urgent climate action,https://www.courant.com/2025/11/17/un-climate-meeting-pressure-action/,2025-11-17,2025,11,2025-11,2025-11-17/2025-11-23,Higher-ranking ministers take charge at COP30 as pressure mounts for urgent climate action
2025-11-17,augustachronicle.com,Climate Change series highlights climate change impacts on agriculture,https://www.augustachronicle.com/story/news/environment/2025/11/17/climate-change-series-highlights-climate-change-impacts-on-agriculture-in-georgia/87271333007/,2025-11-17,2025,11,2025-11,2025-11-17/2025-11-23,Climate Change series highlights climate change impacts on agriculture
2025-11-17,sun-sentinel.com,Higher-ranking ministers take charge at COP30 as pressure mounts for urgent climate action,https://www.sun-sentinel.com/2025/11/17/un-climate-meeting-pressure-action/,2025-11-17,2025,11,2025-11,2025-11-17/2025-11-23,Higher-ranking ministers take charge at COP30 as pressure mounts for urgent climate action
2025-11-17,twincities.com,Higher-ranking ministers take charge at COP30 as pressure mounts for urgent climate action,https://www.twincities.com/2025/11/17/un-climate-meeting-pressure-action/,2025-11-17,2025,11,2025-11,2025-11-17/2025-11-23,Higher-ranking ministers take charge at COP30 as pressure mounts for urgent climate action
2025-11-17,inquirer.com,COP30 delegates dig into toughest issues as climate talks enter final week,https://www.inquirer.com/wires/reuters/america-wire/cop30-delegates-dig-into-toughest-issues-climate-talks-enter-final-week-20251117.html,2025-11-17,2025,11,2025-11,2025-11-17/2025-11-23,COP30 delegates dig into toughest issues as climate talks enter final week
2025-11-17,baltimoresun.com,Higher-ranking ministers take charge at COP30 as pressure mounts for urgent climate action,https://www.baltimoresun.com/2025/11/17/un-climate-meeting-pressure-action/,2025-11-17,2025,11,2025-11,2025-11-17/2025-11-23,Higher-ranking ministers take charge at COP30 as pressure mounts for urgent climate action
2025-11-17,orlandosentinel.com,Higher-ranking ministers take charge at COP30 as pressure mounts for urgent climate action,https://www.orlandosentinel.com/2025/11/17/un-climate-meeting-pressure-action/,2025-11-17,2025,11,2025-11,2025-11-17/2025-11-23,Higher-ranking ministers take charge at COP30 as pressure mounts for urgent climate action
2025-11-17,inquirer.com,Higher-ranking ministers take charge at COP30 as pressure mounts for urgent climate action,https://www.inquirer.com/wires/ap/higher-ranking-ministers-take-charge-cop30-pressure-mounts-urgent-climate-action-20251117.html,2025-11-17,2025,11,2025-11,2025-11-17/2025-11-23,Higher-ranking ministers take charge at COP30 as pressure mounts for urgent climate action
2025-11-17,sandiegouniontribune.com,Higher-ranking ministers take charge at COP30 as pressure mounts for urgent climate action,https://www.sandiegouniontribune.com/2025/11/17/un-climate-meeting-pressure-action/,2025-11-17,2025,11,2025-11,2025-11-17/2025-11-23,Higher-ranking ministers take charge at COP30 as pressure mounts for urgent climate action
2025-11-17,ocregister.com,Higher-ranking ministers take charge at COP30 as pressure mounts for urgent climate action,https://www.ocregister.com/2025/11/17/un-climate-meeting-pressure-action/,2025-11-17,2025,11,2025-11,2025-11-17/2025-11-23,Higher-ranking ministers take charge at COP30 as pressure mounts for urgent climate action
2025-11-17,pilotonline.com,Higher-ranking ministers take charge at COP30 as pressure mounts for urgent climate action,https://www.pilotonline.com/2025/11/17/un-climate-meeting-pressure-action/,2025-11-17,2025,11,2025-11,2025-11-17/2025-11-23,Higher-ranking ministers take charge at COP30 as pressure mounts for urgent climate action
2025-11-17,reuters.com,COP30 delegates dig into toughest issues as climate talks enter final week,https://www.reuters.com/sustainability/cop/cop30-delegates-dig-into-toughest-issues-climate-talks-enter-final-week-2025-11-17/,2025-11-17,2025,11,2025-11,2025-11-17/2025-11-23,COP30 delegates dig into toughest issues as climate talks enter final week
2025-11-17,variety.com,"More Women Filmmakers and Greater Diversity at Ventana Sur’s Primer Corte, Copia Final Programs (EXCLUSIVE)",https://variety.com/2025/film/global/primer-corte-copia-final-kenya-marquez-1236582830/,2025-11-17,2025,11,2025-11,2025-11-17/2025-11-23,"More Women Filmmakers and Greater Diversity at Ventana Sur’s Primer Corte, Copia Final Programs (EXCLUSIVE)"
2025-11-17,cbsnews.com,"SpaceX launches second international satellite to monitor sea level changes, key indicators of climate change",https://www.cbsnews.com/texas/news/spacex-launches-follow-on-international-satellite-to-monitor-sea-level-changes/,2025-11-17,2025,11,2025-11,2025-11-17/2025-11-23,"SpaceX launches second international satellite to monitor sea level changes, key indicators of climate change"
2025-11-17,theguardian.com,Cop30: calls for new urgency to talks as studies show global warming may reach 2.5C – latest updates,https://www.theguardian.com/environment/live/2025/nov/17/cop30-belem-brazil-global-warming-latest-news-updates,2025-11-17,2025,11,2025-11,2025-11-17/2025-11-23,Cop30: calls for new urgency to talks as studies show global warming may reach 2.5C – latest updates
2025-11-17,theconversation.com,Indigenous voices at COP30: The Amazon speaks – will the world listen?,https://theconversation.com/indigenous-voices-at-cop30-the-amazon-speaks-will-the-world-listen-268980,2025-11-17,2025,11,2025-11,2025-11-17/2025-11-23,Indigenous voices at COP30: The Amazon speaks – will the world listen?
2025-11-17,reuters.com,"To make progress on deforestation at COP30, countries must be paid to keep forests standing",https://www.reuters.com/sustainability/land-use-biodiversity/making-it-pay-keep-forests-standing--ecmii-2025-11-17/,2025-11-17,2025,11,2025-11,2025-11-17/2025-11-23,"To make progress on deforestation at COP30, countries must be paid to keep forests standing"
2025-11-17,cnn.com,Could the world’s biggest polluter be its savior against climate change?,https://www.cnn.com/2025/11/17/world/video/china-cop30-greenhouse-climate-change-digvid,2025-11-17,2025,11,2025-11,2025-11-17/2025-11-23,Could the world’s biggest polluter be its savior against climate change?
2025-11-17,cnn.com,This oil-rich country has stood in the way of climate action. It’s quietly building a clean energy empire,https://www.cnn.com/2025/11/17/climate/saudi-arabia-solar-energy-empire,2025-11-17,2025,11,2025-11,2025-11-17/2025-11-23,This oil-rich country has stood in the way of climate action. It’s quietly building a clean energy empire
2025-11-17,bloomberg.com,Fossil Fuel Transition Emerges as Key Climate Fight in Brazil,https://www.bloomberg.com/news/articles/2025-11-17/fossil-fuel-transition-emerges-as-key-climate-fight-in-brazil,2025-11-17,2025,11,2025-11,2025-11-17/2025-11-23,Fossil Fuel Transition Emerges as Key Climate Fight in Brazil
2025-11-17,inquirer.com,"ROI-The future of the energy transition will be fractured, bumpy and long: Bousso",https://www.inquirer.com/wires/reuters/america-wire/roi-the-future-energy-transition-will-be-fractured-bumpy-long-bousso-20251117.html,2025-11-17,2025,11,2025-11,2025-11-17/2025-11-23,"ROI-The future of the energy transition will be fractured, bumpy and long: Bousso"
2025-11-17,reuters.com,"The future of the energy transition will be fractured, bumpy and long",https://www.reuters.com/markets/commodities/future-energy-transition-will-be-fractured-bumpy-long-2025-11-17/,2025-11-17,2025,11,2025-11,2025-11-17/2025-11-23,"The future of the energy transition will be fractured, bumpy and long"
2025-11-17,theconversation.com,"Finally, Indigenous peoples have an influential voice at COP30. They’re speaking loud and clear.",https://theconversation.com/finally-indigenous-peoples-have-an-influential-voice-at-cop30-theyre-speaking-loud-and-clear-269403,2025-11-17,2025,11,2025-11,2025-11-17/2025-11-23,"Finally, Indigenous peoples have an influential voice at COP30. They’re speaking loud and clear."
2025-11-16,dailycaller.com,"MELANIE COLLETTE: COP30, Green Hype, And Real-World Rip-Offs",https://dailycaller.com/2025/11/16/opinion-cop30-green-hype-and-real-world-rip-offs-melanie-collette/,2025-11-16,2025,11,2025-11,2025-11-10/2025-11-16,"MELANIE COLLETTE: COP30, Green Hype, And Real-World Rip-Offs"
2025-11-16,realclearpolitics.com,"10 Years After Paris Agreement, Climatism Is Crumbling",https://www.realclearpolitics.com/2025/11/16/10_years_after_paris_agreement_climatism_is_crumbling_668149.html,2025-11-16,2025,11,2025-11,2025-11-10/2025-11-16,"10 Years After Paris Agreement, Climatism Is Crumbling"
2025-11-17,inquirer.com,Australia PM Albanese rules out co-hosting COP31 with Turkey,https://www.inquirer.com/wires/reuters/america-wire/australia-pm-albanese-rules-out-co-hosting-cop31-with-turkey-20251116.html,2025-11-17,2025,11,2025-11,2025-11-17/2025-11-23,Australia PM Albanese rules out co-hosting COP31 with Turkey
2025-11-16,theguardian.com,"Have courage to create fossil fuel phaseout roadmap at Cop30, Brazilian minister urges",https://www.theguardian.com/environment/2025/nov/16/have-courage-to-create-fossil-fuel-phaseout-roadmap-at-cop30-brazilian-minister-urges,2025-11-16,2025,11,2025-11,2025-11-10/2025-11-16,"Have courage to create fossil fuel phaseout roadmap at Cop30, Brazilian minister urges"
2025-11-16,theguardian.com,Can Cop30 begin the process of phasing out fossil fuels?,https://www.theguardian.com/environment/2025/nov/16/can-cop30-begin-the-process-of-phasing-out-fossil-fuels,2025-11-16,2025,11,2025-11,2025-11-10/2025-11-16,Can Cop30 begin the process of phasing out fossil fuels?
2025-11-16,theguardian.com,South Pacific nation of Tuvalu rebukes Trump’s ‘shameful disregard’ at Cop30,https://www.theguardian.com/environment/2025/nov/16/cop30-tuvalu-trump,2025-11-16,2025,11,2025-11,2025-11-10/2025-11-16,South Pacific nation of Tuvalu rebukes Trump’s ‘shameful disregard’ at Cop30
2025-11-16,arkansasonline.com,Climate protesters march on COP30,https://www.arkansasonline.com/news/2025/nov/16/climate-protesters-march-on-cop30/,2025-11-16,2025,11,2025-11,2025-11-10/2025-11-16,Climate protesters march on COP30
2025-11-16,theconversation.com,"View from The Hill: Coalition parties jointly cremate net zero, while leadership contenders circle Sussan Ley",https://theconversation.com/view-from-the-hill-coalition-parties-jointly-cremate-net-zero-while-leadership-contenders-circle-sussan-ley-269396,2025-11-16,2025,11,2025-11,2025-11-10/2025-11-16,"View from The Hill: Coalition parties jointly cremate net zero, while leadership contenders circle Sussan Ley"
2025-11-16,techcrunch.com,How much of the AI data center boom will be powered by renewable energy?,https://techcrunch.com/2025/11/16/how-much-of-the-ai-data-center-boom-will-be-powered-by-renewable-energy/,2025-11-16,2025,11,2025-11,2025-11-10/2025-11-16,How much of the AI data center boom will be powered by renewable energy?
2025-11-16,forbes.com,China’s Carbon Plateau: A Turning Point Or A Temporary Pause?,https://www.forbes.com/sites/rrapier/2025/11/16/chinas-carbon-plateau-a-turning-point-or-a-temporary-pause/,2025-11-16,2025,11,2025-11,2025-11-10/2025-11-16,China’s Carbon Plateau: A Turning Point Or A Temporary Pause?
2025-11-16,reuters.com,"Turkey proposed joint leadership for COP31 to end hosting standoff with Australia, sources say",https://www.reuters.com/sustainability/cop/turkey-proposed-joint-leadership-cop31-end-hosting-standoff-with-australia-2025-11-16/,2025-11-16,2025,11,2025-11,2025-11-10/2025-11-16,"Turkey proposed joint leadership for COP31 to end hosting standoff with Australia, sources say"
2025-11-16,courant.com,Kids most affected by climate change explore jobs to fix it at the Future Green Leaders Summit,https://www.courant.com/2025/11/16/kids-most-affected-by-climate-change-explore-jobs-to-fix-it-at-the-future-green-leaders-summit-2/,2025-11-16,2025,11,2025-11,2025-11-10/2025-11-16,Kids most affected by climate change explore jobs to fix it at the Future Green Leaders Summit
2025-11-16,inquirer.com,"Turkey proposed joint leadership for COP31 to end hosting standoff with Australia, sources say",https://www.inquirer.com/wires/reuters/america-wire/turkey-proposed-joint-leadership-cop31-end-hosting-standoff-with-australia-sources-say-20251116.html,2025-11-16,2025,11,2025-11,2025-11-10/2025-11-16,"Turkey proposed joint leadership for COP31 to end hosting standoff with Australia, sources say"
2025-11-16,orlandosentinel.com,Commentary: Bill Gates wasn’t downplaying climate change. He was urging innovation,https://www.orlandosentinel.com/2025/11/16/commentary-bill-gates-wasnt-downplaying-climate-change-he-was-urging-innovation/,2025-11-16,2025,11,2025-11,2025-11-10/2025-11-16,Commentary: Bill Gates wasn’t downplaying climate change. He was urging innovation
2025-11-16,abcnews.go.com,Czech Republic plans $19 billion nuclear expansion to end fossil fuel reliance,https://abcnews.go.com/International/wireStory/czech-republic-plans-19-billion-nuclear-expansion-double-127566637,2025-11-16,2025,11,2025-11,2025-11-10/2025-11-16,Czech Republic plans $19 billion nuclear expansion to end fossil fuel reliance
2025-11-15,seattletimes.com,Czech Republic plans $19 billion nuclear expansion to double output and end fossil fuel reliance,https://www.seattletimes.com/business/czech-republic-plans-19-billion-nuclear-expansion-to-double-output-and-end-fossil-fuel-reliance/?utm_source=RSS&utm_medium=Referral&utm_campaign=RSS_all,2025-11-15,2025,11,2025-11,2025-11-10/2025-11-16,Czech Republic plans $19 billion nuclear expansion to double output and end fossil fuel reliance
2025-11-16,newsday.com,Czech Republic plans $19 billion nuclear expansion to double output and end fossil fuel reliance,https://www.newsday.com/business/czech-nuclear-energy-expansion-w26502,2025-11-16,2025,11,2025-11,2025-11-10/2025-11-16,Czech Republic plans $19 billion nuclear expansion to double output and end fossil fuel reliance
2025-11-16,inquirer.com,Czech Republic plans $19 billion nuclear expansion to double output and end fossil fuel reliance,https://www.inquirer.com/wires/ap/czech-republic-plans-19-billion-nuclear-expansion-double-output-end-fossil-fuel-reliance-20251116.html,2025-11-16,2025,11,2025-11,2025-11-10/2025-11-16,Czech Republic plans $19 billion nuclear expansion to double output and end fossil fuel reliance
2025-11-15,nbcnews.com,China finds bigger role as U.S. sidesteps Brazil COP30 climate summit,https://www.nbcnews.com/world/china/china-finds-bigger-role-us-sidesteps-brazil-cop30-climate-summit-rcna244079,2025-11-15,2025,11,2025-11,2025-11-10/2025-11-16,China finds bigger role as U.S. sidesteps Brazil COP30 climate summit
2025-11-14,latimes.com,Protesters in Pikachu costumes demand Japan end fossil fuel financing at U.N. climate conference,https://www.latimes.com/environment/story/2025-11-14/protesters-in-pikachu-costumes-demand-japan-end-fossil-fuel-financing,2025-11-14,2025,11,2025-11,2025-11-10/2025-11-16,Protesters in Pikachu costumes demand Japan end fossil fuel financing at U.N. climate conference
2025-11-15,townhall.com,COP-30 insanity vs Global Tide of Climate and Energy Reality,https://townhall.com/columnists/pauldriessen/2025/11/15/cop-30-insanity-vs-global-tide-of-climate-and-energy-reality-n2666511,2025-11-15,2025,11,2025-11,2025-11-10/2025-11-16,COP-30 insanity vs Global Tide of Climate and Energy Reality
2025-11-15,pbs.org,Thousands of climate protesters march on COP30,https://www.pbs.org/newshour/world/thousands-of-climate-protesters-march-on-cop30,2025-11-15,2025,11,2025-11,2025-11-10/2025-11-16,Thousands of climate protesters march on COP30
2025-11-14,newsweek.com,Whitehouse Calls Trump’s Climate Moves ‘Thuggish’ as He Goes Solo at COP30,https://www.newsweek.com/whitehouse-calls-trumps-climate-moves-thuggish-as-he-goes-solo-at-cop30-11051633,2025-11-14,2025,11,2025-11,2025-11-10/2025-11-16,Whitehouse Calls Trump’s Climate Moves ‘Thuggish’ as He Goes Solo at COP30
2025-11-15,bostonglobe.com,Climate protesters demand to be heard as they march on COP30 with costumes and drums,https://www.bostonglobe.com/2025/11/15/world/climate-protesters-demand-be-heard-they-march-cop30-with-costumes-drums/,2025-11-15,2025,11,2025-11,2025-11-10/2025-11-16,Climate protesters demand to be heard as they march on COP30 with costumes and drums
2025-11-15,theguardian.com,Thousands hit streets of Belém to call for action during crucial Cop30 summit,https://www.theguardian.com/environment/2025/nov/15/thousands-hit-streets-of-belem-to-call-for-action-during-crucial-cop30-summit,2025-11-15,2025,11,2025-11,2025-11-10/2025-11-16,Thousands hit streets of Belém to call for action during crucial Cop30 summit
2025-11-15,theguardian.com,"Factchecking five Coalition claims about net zero, from power prices to the $9tn cost",https://www.theguardian.com/australia-news/2025/nov/16/coalition-net-zero-emissions-claims-factcheck-electricity-price-power-bill-cost,2025-11-15,2025,11,2025-11,2025-11-10/2025-11-16,"Factchecking five Coalition claims about net zero, from power prices to the $9tn cost"
2025-11-15,theguardian.com,"Indigenous lands must be recognised as part of climate policy, says Brazilian minister",https://www.theguardian.com/environment/2025/nov/15/indigenous-lands-must-be-recognised-as-part-of-climate-policy-says-brazilian-minister,2025-11-15,2025,11,2025-11,2025-11-10/2025-11-16,"Indigenous lands must be recognised as part of climate policy, says Brazilian minister"
2025-11-15,reuters.com,Climate protesters swelter in Brazilian sun outside COP30 summit,https://www.reuters.com/sustainability/cop/climate-protesters-swelter-brazilian-sun-outside-cop30-summit-2025-11-15/,2025-11-15,2025,11,2025-11,2025-11-10/2025-11-16,Climate protesters swelter in Brazilian sun outside COP30 summit
2025-11-15,grist.org,'Everyone is exhausted': First week of COP30 marked by frustration with slow progress,https://grist.org/cop30/built-to-fail-rules-at-un-climate-talks-favor-the-status-quo-not-progress/,2025-11-15,2025,11,2025-11,2025-11-10/2025-11-16,'Everyone is exhausted': First week of COP30 marked by frustration with slow progress
2025-11-15,abcnews.go.com,The Trump administration didn't send a delegation to COP30. How the US is maintaining a presence at the climate summit,https://abcnews.go.com/US/trump-administration-send-delegation-cop30-us-maintaining-presence/story?id=127524096,2025-11-15,2025,11,2025-11,2025-11-10/2025-11-16,The Trump administration didn't send a delegation to COP30. How the US is maintaining a presence at the climate summit
2025-11-15,cbsnews.com,Climate protesters march on COP30 with costumes and drums demanding to be heard,https://www.cbsnews.com/news/climate-protesters-march-on-cop30-costumes-and-drums/,2025-11-15,2025,11,2025-11,2025-11-10/2025-11-16,Climate protesters march on COP30 with costumes and drums demanding to be heard
2025-11-15,newsday.com,Climate protesters demand to be heard as they march on COP30 with costumes and drums,https://www.newsday.com/news/nation/belem-brazil-united-nations-climate-talks-cop30-o22196,2025-11-15,2025,11,2025-11,2025-11-10/2025-11-16,Climate protesters demand to be heard as they march on COP30 with costumes and drums
