publish_date,media_name,title,url,date,year,month,year_month,week,title_clean
2025-11-28,benzinga.com,"Canada supports the Nunatsiavut Government's leadership in Inuit-led, community-based clean energy initiatives",https://www.benzinga.com/pressreleases/25/11/n49123873/canada-supports-the-nunatsiavut-governments-leadership-in-inuit-led-community-based-clean-energy-i?utm_source=benzinga_taxonomy&utm_medium=rss_feed_free&utm_content=taxonomy_rss&utm_campaign=channel,2025-11-28,2025,11,2025-11,2025-11-24/2025-11-30,"Canada supports the Nunatsiavut Government's leadership in Inuit-led, community-based clean energy initiatives"
2025-11-28,dailykos.com,"US is (officially) gone, but not forgotten, at COP30",https://www.dailykos.com/stories/2025/11/28/2355413/-US-is-officially-gone-but-not-forgotten-at-COP30?pm_campaign=blog&pm_medium=rss&pm_source=main,2025-11-28,2025,11,2025-11,2025-11-24/2025-11-30,"US is (officially) gone, but not forgotten, at COP30"
2025-11-28,theconversation.com,Green transition targets are not realistic – how to decarbonise at the right pace,https://theconversation.com/green-transition-targets-are-not-realistic-how-to-decarbonise-at-the-right-pace-270720,2025-11-28,2025,11,2025-11,2025-11-24/2025-11-30,Green transition targets are not realistic – how to decarbonise at the right pace
2025-11-28,forbes.com,Why Action On Super Pollutants Was A Key COP30 Victory,https://www.forbes.com/sites/jamiehailstone/2025/11/28/why-action-on-super-pollutants-was-one-a-key-cop30-victory/,2025-11-28,2025,11,2025-11,2025-11-24/2025-11-30,Why Action On Super Pollutants Was A Key COP30 Victory
2025-11-28,huffpost.com,This Coping Behavior Is Super Common Right Now — And It Says So Much About Where We Are As A Country,https://www.huffpost.com/entry/dissociation-protect-mental-health_l_69270610e4b0ee43600b68e5,2025-11-28,2025,11,2025-11,2025-11-24/2025-11-30,This Coping Behavior Is Super Common Right Now — And It Says So Much About Where We Are As A Country
2025-11-28,theguardian.com,"Australia’s ‘protestival’: kayaks, music, a push for climate change action – and the risk of arrest",https://www.theguardian.com/australia-news/2025/nov/28/australia-protestival-newcastle-rising-tide-music-climate-change,2025-11-28,2025,11,2025-11,2025-11-24/2025-11-30,"Australia’s ‘protestival’: kayaks, music, a push for climate change action – and the risk of arrest"
2025-11-28,theconversation.com,Three reasons why China wants global green leadership after Cop30 – and two reasons it doesn’t,https://theconversation.com/three-reasons-why-china-wants-global-green-leadership-after-cop30-and-two-reasons-it-doesnt-270329,2025-11-28,2025,11,2025-11,2025-11-24/2025-11-30,Three reasons why China wants global green leadership after Cop30 – and two reasons it doesn’t
2025-11-28,reuters.com,COP30: Momentum grows behind carbon markets as a climate solution,https://www.reuters.com/sustainability/land-use-biodiversity/cop30-momentum-grows-behind-carbon-markets-climate-solution--ecmii-2025-11-28/,2025-11-28,2025,11,2025-11,2025-11-24/2025-11-30,COP30: Momentum grows behind carbon markets as a climate solution
2025-11-28,livescience.com,Climate change is real. It's happening. And it's time to make it personal.,https://www.livescience.com/planet-earth/climate-change/climate-change-is-real-its-happening-and-its-time-to-make-it-personal-opinion,2025-11-28,2025,11,2025-11,2025-11-24/2025-11-30,Climate change is real. It's happening. And it's time to make it personal.
2025-11-28,sandiegouniontribune.com,"‘Critical’ to ‘course-correct’: San Diego is heading in the wrong direction on greenhouse gas emissions, new data show",https://www.sandiegouniontribune.com/2025/11/28/critical-to-course-correct-san-diego-is-heading-in-the-wrong-direction-on-greenhouse-gas-emissions-new-data-show/,2025-11-28,2025,11,2025-11,2025-11-24/2025-11-30,"‘Critical’ to ‘course-correct’: San Diego is heading in the wrong direction on greenhouse gas emissions, new data show"
2025-11-28,benzinga.com,CCTV+: Driving Low-Carbon Mining: How Breton's Autonomous Electric Mining Trucks Strengthen ESG Performance,https://www.benzinga.com/pressreleases/25/11/n49113075/cctv-driving-low-carbon-mining-how-bretons-autonomous-electric-mining-trucks-strengthen-esg-perfor?utm_source=benzinga_taxonomy&utm_medium=rss_feed_free&utm_content=taxonomy_rss&utm_campaign=channel,2025-11-28,2025,11,2025-11,2025-11-24/2025-11-30,CCTV+: Driving Low-Carbon Mining: How Breton's Autonomous Electric Mining Trucks Strengthen ESG Performance
2025-11-28,benzinga.com,Ecopetrol Group to Invest Between COP 22 and 27 Trillion in 2026,https://www.benzinga.com/pressreleases/25/11/n49113185/ecopetrol-group-to-invest-between-cop-22-and-27-trillion-in-2026?utm_source=benzinga_taxonomy&utm_medium=rss_feed_free&utm_content=taxonomy_rss&utm_campaign=channel,2025-11-28,2025,11,2025-11,2025-11-24/2025-11-30,Ecopetrol Group to Invest Between COP 22 and 27 Trillion in 2026
2025-11-28,reuters.com,"No roadmap to end deforestation, but Brazil’s COP in the Amazon delivered for forests",https://www.reuters.com/sustainability/land-use-biodiversity/no-roadmap-end-deforestation-brazils-cop-amazon-delivered-forests--ecmii-2025-11-28/,2025-11-28,2025,11,2025-11,2025-11-24/2025-11-30,"No roadmap to end deforestation, but Brazil’s COP in the Amazon delivered for forests"
2025-11-28,theguardian.com,"Beyond the negative headlines, some truly good things came out of Cop30",https://www.theguardian.com/environment/2025/nov/27/beyond-the-negative-headlines-some-truly-good-things-came-out-of-cop30,2025-11-28,2025,11,2025-11,2025-11-24/2025-11-30,"Beyond the negative headlines, some truly good things came out of Cop30"
2025-11-28,theguardian.com,"Africa’s forests transformed from carbon sink to carbon source, study finds",https://www.theguardian.com/environment/2025/nov/28/africa-forests-transformed-carbon-sink-carbon-source-study,2025-11-28,2025,11,2025-11,2025-11-24/2025-11-30,"Africa’s forests transformed from carbon sink to carbon source, study finds"
2025-11-28,fortune.com,I went to COP30—and saw how the rest of the world is pushing climate action even as the U.S. steps back,https://fortune.com/2025/11/28/cop30-brazil-asia-climate-change-global-south/,2025-11-28,2025,11,2025-11,2025-11-24/2025-11-30,I went to COP30—and saw how the rest of the world is pushing climate action even as the U.S. steps back
2025-11-27,bloomberg.com,Australia’s Path to Net Zero Just Got Tougher,https://www.bloomberg.com/news/newsletters/2025-11-27/net-zero-goals-environment-laws-china-warns-new-zealand,2025-11-27,2025,11,2025-11,2025-11-24/2025-11-30,Australia’s Path to Net Zero Just Got Tougher
2025-11-27,theconversation.com,Cop30 saw important developments amid huge disappointment,https://theconversation.com/cop30-saw-important-developments-amid-huge-disappointment-270712,2025-11-27,2025,11,2025-11,2025-11-24/2025-11-30,Cop30 saw important developments amid huge disappointment
2025-11-27,benzinga.com,"Minister Steven Guilbeault Concludes Participation at COP30, Reaffirming Canada's Leadership on Nature Conservation and Protection",https://www.benzinga.com/pressreleases/25/11/n49106431/minister-steven-guilbeault-concludes-participation-at-cop30-reaffirming-canadas-leadership-on-natu?utm_source=benzinga_taxonomy&utm_medium=rss_feed_free&utm_content=taxonomy_rss&utm_campaign=channel,2025-11-27,2025,11,2025-11,2025-11-24/2025-11-30,"Minister Steven Guilbeault Concludes Participation at COP30, Reaffirming Canada's Leadership on Nature Conservation and Protection"
2025-11-27,schwartzreport.net,"US, Russia and Saudi Arabia create axis of obstruction as Cop30 sputters out",https://www.schwartzreport.net/2025/11/27/us-russia-and-saudi-arabia-create-axis-of-obstruction-as-cop30-sputters-out/,2025-11-27,2025,11,2025-11,2025-11-24/2025-11-30,"US, Russia and Saudi Arabia create axis of obstruction as Cop30 sputters out"
2025-11-27,reuters.com,"COP 30: Big pledges on renewables and industry, but ambition falters on ending fossil fuels",https://www.reuters.com/sustainability/climate-energy/cop-30-big-pledges-renewables-industry-ambition-falters-ending-fossil-fuels--ecmii-2025-11-27/,2025-11-27,2025,11,2025-11,2025-11-24/2025-11-30,"COP 30: Big pledges on renewables and industry, but ambition falters on ending fossil fuels"
2025-11-27,bloomberg.com,Australia Risks 2035 Climate Goal Without Bigger Emissions Cuts,https://www.bloomberg.com/news/articles/2025-11-27/australia-risks-2035-climate-goal-without-bigger-emissions-cuts,2025-11-27,2025,11,2025-11,2025-11-24/2025-11-30,Australia Risks 2035 Climate Goal Without Bigger Emissions Cuts
2025-11-27,reuters.com,Australia needs to speed up emissions cuts to meet 2035 target,https://www.reuters.com/sustainability/cop/australia-needs-speed-up-emissions-cuts-meet-2035-target-2025-11-27/,2025-11-27,2025,11,2025-11,2025-11-24/2025-11-30,Australia needs to speed up emissions cuts to meet 2035 target
2025-11-26,bostonglobe.com,John Kerry knighted in England for climate change work. ‘King Charles and I share the same point of view.’,https://www.bostonglobe.com/2025/11/26/metro/john-kerry-knighted-climate-change-king-charles-iii/,2025-11-26,2025,11,2025-11,2025-11-24/2025-11-30,John Kerry knighted in England for climate change work. ‘King Charles and I share the same point of view.’
2025-11-26,bloomberg.com,Trumponomics: Keeping Globalization Alive Amid 'Geopolitical Climate Change',https://www.bloomberg.com/news/audio/2025-11-26/trumponomics-keeping-globalization-alive-podcast,2025-11-26,2025,11,2025-11,2025-11-24/2025-11-30,Trumponomics: Keeping Globalization Alive Amid 'Geopolitical Climate Change'
2025-11-26,bloomberg.com,"US Absence Hurt Fossil Fuel Exit Push at COP30, Says Brazil’s Silva",https://www.bloomberg.com/news/articles/2025-11-26/us-absence-hurt-fossil-fuel-exit-push-at-cop30-says-brazil-s-silva,2025-11-26,2025,11,2025-11,2025-11-24/2025-11-30,"US Absence Hurt Fossil Fuel Exit Push at COP30, Says Brazil’s Silva"
2025-11-26,forbes.com,How Climate Change Sounds Using Data Sonification,https://www.forbes.com/sites/marshallshepherd/2025/11/26/how-climate-change-sounds-using-data-sonification/,2025-11-26,2025,11,2025-11,2025-11-24/2025-11-30,How Climate Change Sounds Using Data Sonification
2025-11-26,forbes.com,"How Climate Change, Dialysis Footprint And Heat Stress Are Fueling The Chronic Kidney Disease Crisis",https://www.forbes.com/councils/forbestechcouncil/2025/11/26/how-climate-change-dialysis-footprint-and-heat-stress-are-fueling-the-chronic-kidney-disease-crisis/,2025-11-26,2025,11,2025-11,2025-11-24/2025-11-30,"How Climate Change, Dialysis Footprint And Heat Stress Are Fueling The Chronic Kidney Disease Crisis"
2025-11-26,theconversation.com,"COP30: petrostates block climate deal once again, but some countries are taking their own decisive steps to phase out fossil fuels",https://theconversation.com/cop30-petrostates-block-climate-deal-once-again-but-some-countries-are-taking-their-own-decisive-steps-to-phase-out-fossil-fuels-270580,2025-11-26,2025,11,2025-11,2025-11-24/2025-11-30,"COP30: petrostates block climate deal once again, but some countries are taking their own decisive steps to phase out fossil fuels"
2025-11-26,benzinga.com,"Results of the November 19, 2025 Québec and California Carbon Markets Auction",https://www.benzinga.com/pressreleases/25/11/n49095077/results-of-the-november-19-2025-qu-bec-and-california-carbon-markets-auction?utm_source=benzinga_taxonomy&utm_medium=rss_feed_free&utm_content=taxonomy_rss&utm_campaign=channel,2025-11-26,2025,11,2025-11,2025-11-24/2025-11-30,"Results of the November 19, 2025 Québec and California Carbon Markets Auction"
2025-11-26,theguardian.com,"Protests, tears and a baby: five key images that tell the story of Cop30",https://www.theguardian.com/environment/2025/nov/26/five-key-images-cop30-climate-change-conference-united-nations,2025-11-26,2025,11,2025-11,2025-11-24/2025-11-30,"Protests, tears and a baby: five key images that tell the story of Cop30"
2025-11-26,theguardian.com,Australia’s emissions from fossil fuels down as electricity from renewables passes 40%,https://www.theguardian.com/australia-news/2025/nov/26/australia-greenhouse-gas-emissions-from-fossil-fuels-down,2025-11-26,2025,11,2025-11,2025-11-24/2025-11-30,Australia’s emissions from fossil fuels down as electricity from renewables passes 40%
2025-11-26,theguardian.com,Cop30 and the climate fight: inside the 28 November Guardian Weekly,https://www.theguardian.com/news/2025/nov/26/cop30-and-the-climate-fight-inside-the-28-november-guardian-weekly,2025-11-26,2025,11,2025-11,2025-11-24/2025-11-30,Cop30 and the climate fight: inside the 28 November Guardian Weekly
2025-11-26,theguardian.com,John Kerry urges Australia to take ‘hard-nosed’ approach with world’s biggest fossil fuel-producing countries at Cop31,https://www.theguardian.com/us-news/2025/nov/26/john-kerry-australia-carbon-emitters-cop31-climate-summit,2025-11-26,2025,11,2025-11,2025-11-24/2025-11-30,John Kerry urges Australia to take ‘hard-nosed’ approach with world’s biggest fossil fuel-producing countries at Cop31
2025-11-26,reuters.com,COP30 inched the world forward on climate action. Business wants to sprint,https://www.reuters.com/sustainability/climate-energy/cop30-inched-world-forward-climate-action-business-wants-sprint--ecmii-2025-11-26/,2025-11-26,2025,11,2025-11,2025-11-24/2025-11-30,COP30 inched the world forward on climate action. Business wants to sprint
2025-11-26,vox.com,"The long, fun list of things we could do with unlimited clean energy",https://www.vox.com/climate/470389/energy-abundance-solar-wind-nuclear-desalination-food-climate,2025-11-26,2025,11,2025-11,2025-11-24/2025-11-30,"The long, fun list of things we could do with unlimited clean energy"
2025-11-26,benzinga.com,R E P E A T --Media advisory - Environment and Climate Change Canada to hold an information session and media availability related to an upcoming winter storm affecting Ontario and Quebec/,https://www.benzinga.com/pressreleases/25/11/n49079275/r-e-p-e-a-t-media-advisory-environment-and-climate-change-canada-to-hold-an-information-session-an?utm_source=benzinga_taxonomy&utm_medium=rss_feed_free&utm_content=taxonomy_rss&utm_campaign=channel,2025-11-26,2025,11,2025-11,2025-11-24/2025-11-30,R E P E A T --Media advisory - Environment and Climate Change Canada to hold an information session and media availability related to an upcoming winter storm affecting Ontario and Quebec/
2025-11-26,orlandosentinel.com,Commentary: How to talk to your skeptical parents about climate change at Thanksgiving,https://www.orlandosentinel.com/2025/11/26/commentary-how-to-talk-to-your-skeptical-parents-about-climate-change-at-thanksgiving/,2025-11-26,2025,11,2025-11,2025-11-24/2025-11-30,Commentary: How to talk to your skeptical parents about climate change at Thanksgiving
2025-11-26,cbsnews.com,Travelers cope with Thanksgiving travel getaway,https://www.cbsnews.com/newyork/video/travelers-cope-with-thanksgiving-travel-getaway/,2025-11-26,2025,11,2025-11,2025-11-24/2025-11-30,Travelers cope with Thanksgiving travel getaway
2025-11-26,benzinga.com,After COP30 - SKF brings industry together to accelerate sustainable transformation,https://www.benzinga.com/pressreleases/25/11/n49078081/after-cop30-skf-brings-industry-together-to-accelerate-sustainable-transformation?utm_source=benzinga_taxonomy&utm_medium=rss_feed_free&utm_content=taxonomy_rss&utm_campaign=channel,2025-11-26,2025,11,2025-11,2025-11-24/2025-11-30,After COP30 - SKF brings industry together to accelerate sustainable transformation
2025-11-25,forbes.com,How Green Banks Are Financing The Future Of Clean Energy,https://www.forbes.com/sites/brynncooksey/2025/11/25/how-green-banks-are-financing-the-future-of-clean-energy/,2025-11-25,2025,11,2025-11,2025-11-24/2025-11-30,How Green Banks Are Financing The Future Of Clean Energy
2025-11-25,forbes.com,The Role Of AI In Addressing Climate Change,https://www.forbes.com/councils/forbestechcouncil/2025/11/25/the-role-of-ai-in-addressing-climate-change/,2025-11-25,2025,11,2025-11,2025-11-24/2025-11-30,The Role Of AI In Addressing Climate Change
2025-11-25,benzinga.com,Media advisory - Environment and Climate Change Canada to hold an information session and media availability related to an upcoming winter storm affecting Ontario and Quebec,https://www.benzinga.com/pressreleases/25/11/n49074667/media-advisory-environment-and-climate-change-canada-to-hold-an-information-session-and-media-avai?utm_source=benzinga_taxonomy&utm_medium=rss_feed_free&utm_content=taxonomy_rss&utm_campaign=channel,2025-11-25,2025,11,2025-11,2025-11-24/2025-11-30,Media advisory - Environment and Climate Change Canada to hold an information session and media availability related to an upcoming winter storm affecting Ontario and Quebec
2025-11-25,ictnews.org,Indigenous people reflect on the meaning of their participation in COP30 climate talks,https://ictnews.org/news/global-indigenous/indigenous-people-reflect-on-the-meaning-of-their-participation-in-cop30-climate-talks/,2025-11-25,2025,11,2025-11,2025-11-24/2025-11-30,Indigenous people reflect on the meaning of their participation in COP30 climate talks
2025-11-25,oregonlive.com,Alaska Native villages have few options and little US help as climate change devours their land,https://www.oregonlive.com/native-american-news/2025/11/alaska-native-villages-have-few-options-and-little-us-help-as-climate-change-devours-their-land.html,2025-11-25,2025,11,2025-11,2025-11-24/2025-11-30,Alaska Native villages have few options and little US help as climate change devours their land
2025-11-25,motherjones.com,Can the world address climate change without the US?,https://www.motherjones.com/environment/2025/11/cop30-brazil-us-climate-warming-trump/,2025-11-25,2025,11,2025-11,2025-11-24/2025-11-30,Can the world address climate change without the US?
2025-11-25,mlive.com,Alaska Native villages have few options and little US help as climate change devours their land,https://www.mlive.com/native-american-news/2025/11/alaska-native-villages-have-few-options-and-little-us-help-as-climate-change-devours-their-land.html,2025-11-25,2025,11,2025-11,2025-11-24/2025-11-30,Alaska Native villages have few options and little US help as climate change devours their land
2025-11-25,syracuse.com,Alaska Native villages have few options and little US help as climate change devours their land,https://www.syracuse.com/native-american-news/2025/11/alaska-native-villages-have-few-options-and-little-us-help-as-climate-change-devours-their-land.html,2025-11-25,2025,11,2025-11,2025-11-24/2025-11-30,Alaska Native villages have few options and little US help as climate change devours their land
2025-11-25,cleveland.com,Alaska Native villages have few options and little US help as climate change devours their land,https://www.cleveland.com/native-american-news/2025/11/alaska-native-villages-have-few-options-and-little-us-help-as-climate-change-devours-their-land.html,2025-11-25,2025,11,2025-11,2025-11-24/2025-11-30,Alaska Native villages have few options and little US help as climate change devours their land
2025-11-13,theconversation.com,New report reveals how climate change is spreading infectious diseases to new regions,https://theconversation.com/new-report-reveals-how-climate-change-is-spreading-infectious-diseases-to-new-regions-269439,2025-11-13,2025,11,2025-11,2025-11-10/2025-11-16,New report reveals how climate change is spreading infectious diseases to new regions
2025-11-13,theconversation.com,Zimbabwe’s forest and energy projects reveal the downside of carbon credits,https://theconversation.com/zimbabwes-forest-and-energy-projects-reveal-the-downside-of-carbon-credits-267020,2025-11-13,2025,11,2025-11,2025-11-10/2025-11-16,Zimbabwe’s forest and energy projects reveal the downside of carbon credits
2025-11-25,newsweek.com,Harvard Economist Cites ‘Important’ COP30 Development on Climate and Trade,https://www.newsweek.com/harvard-economist-cites-important-cop30-development-on-climate-and-trade-11102465,2025-11-25,2025,11,2025-11,2025-11-24/2025-11-30,Harvard Economist Cites ‘Important’ COP30 Development on Climate and Trade
2025-11-25,theguardian.com,Guardian Essential poll: only a quarter of older Australians believe climate change can be prevented,https://www.theguardian.com/australia-news/2025/nov/25/guardian-essential-poll-only-a-quarter-of-older-australians-believe-climate-change-can-be-prevented,2025-11-25,2025,11,2025-11,2025-11-24/2025-11-30,Guardian Essential poll: only a quarter of older Australians believe climate change can be prevented
2025-11-25,theguardian.com,"US, Russia and Saudi Arabia create axis of obstruction as Cop30 sputters out",https://www.theguardian.com/environment/2025/nov/25/trump-cop30-lacks-us-climate-progress,2025-11-25,2025,11,2025-11,2025-11-24/2025-11-30,"US, Russia and Saudi Arabia create axis of obstruction as Cop30 sputters out"
2025-11-25,abcnews.go.com,Mount Rainier may be shrinking due to climate change: Study,https://abcnews.go.com/US/mount-rainier-shrinking-due-climate-change-study/story?id=127861385,2025-11-25,2025,11,2025-11,2025-11-24/2025-11-30,Mount Rainier may be shrinking due to climate change: Study
2025-11-25,bostonglobe.com,Your New England home insurance could vanish. Climate change explains why.,https://www.bostonglobe.com/2025/11/25/science/climate-change-home-insurance-vineyard/,2025-11-25,2025,11,2025-11,2025-11-24/2025-11-30,Your New England home insurance could vanish. Climate change explains why.
2025-11-25,townhall.com,COP30 Unveils the Climate Speech Police,https://townhall.com/columnists/anthonywatts/2025/11/25/cop30-unveils-the-climate-speech-police-n2666958,2025-11-25,2025,11,2025-11,2025-11-24/2025-11-30,COP30 Unveils the Climate Speech Police
2025-11-25,sun-sentinel.com,How to talk to skeptical family about climate change,https://www.sun-sentinel.com/2025/11/25/how-to-talk-to-skeptical-family-about-climate-change-opinion/,2025-11-25,2025,11,2025-11,2025-11-24/2025-11-30,How to talk to skeptical family about climate change
2025-11-24,bloomberg.com,Indigenous Peoples’ Demands Got More Than Lip Service at COP30,https://www.bloomberg.com/news/articles/2025-11-24/indigenous-peoples-demands-got-more-than-lip-service-at-cop30,2025-11-24,2025,11,2025-11,2025-11-24/2025-11-30,Indigenous Peoples’ Demands Got More Than Lip Service at COP30
2025-11-24,bloomberg.com,Inside the Human Aspect of Climate Meetings — a Collection of COP Memories,https://www.bloomberg.com/news/articles/2025-11-24/inside-the-human-aspect-of-climate-meetings-a-collection-of-cop-memories,2025-11-24,2025,11,2025-11,2025-11-24/2025-11-30,Inside the Human Aspect of Climate Meetings — a Collection of COP Memories
2025-11-25,bloomberg.com,There's Already a Deal to Beat Dirty Fossil Fuels,https://www.bloomberg.com/opinion/articles/2025-11-25/fossil-fuels-at-un-cop30-there-is-already-a-deal-to-beat-them,2025-11-25,2025,11,2025-11,2025-11-24/2025-11-30,There's Already a Deal to Beat Dirty Fossil Fuels
2025-11-25,theguardian.com,‘Fossil fuel giants finally in the crosshairs’: Cop30 avoids total failure with last-ditch deal,https://www.theguardian.com/environment/2025/nov/25/fossil-fuel-giants-finally-in-the-crosshairs-cop30-avoids-total-failure-with-last-ditch-deal,2025-11-25,2025,11,2025-11,2025-11-24/2025-11-30,‘Fossil fuel giants finally in the crosshairs’: Cop30 avoids total failure with last-ditch deal
2025-11-25,theweek.com,Can for-profit geoengineering put a pause on climate change?,https://theweek.com/environment/geoengineering-climate-change-dimming-sun,2025-11-25,2025,11,2025-11,2025-11-24/2025-11-30,Can for-profit geoengineering put a pause on climate change?
2025-11-25,reuters.com,"UK development arm makes first, $150 mln push into energy transition financing",https://www.reuters.com/sustainability/cop/uk-development-arm-makes-first-150-mln-push-into-energy-transition-financing-2025-11-25/,2025-11-25,2025,11,2025-11,2025-11-24/2025-11-30,"UK development arm makes first, $150 mln push into energy transition financing"
2025-11-24,benzinga.com,Statement - Canada at COP30: Advancing a shared vision for inclusive and sustainable climate action to keep the 1.5 °C within reach,https://www.benzinga.com/pressreleases/25/11/n49044100/statement-canada-at-cop30-advancing-a-shared-vision-for-inclusive-and-sustainable-climate-action-t?utm_source=benzinga_taxonomy&utm_medium=rss_feed_free&utm_content=taxonomy_rss&utm_campaign=channel,2025-11-24,2025,11,2025-11,2025-11-24/2025-11-30,Statement - Canada at COP30: Advancing a shared vision for inclusive and sustainable climate action to keep the 1.5 °C within reach
2025-11-24,time.com,What Climate Change Means For Your Thanksgiving Dinner,https://time.com/7336559/climate-change-impact-thanksgiving-dinner/,2025-11-24,2025,11,2025-11,2025-11-24/2025-11-30,What Climate Change Means For Your Thanksgiving Dinner
2025-11-24,realclearpolitics.com,It Was a Mistake To See Electric Vehicles as Climate Policy,https://www.realclearpolitics.com/2025/11/24/it_was_a_mistake_to_see_electric_vehicles_as_climate_policy_670270.html,2025-11-24,2025,11,2025-11,2025-11-24/2025-11-30,It Was a Mistake To See Electric Vehicles as Climate Policy
2025-11-24,breitbart.com,"COP30 Climate Summit Ends with 'Roadmap,' but No Vow, to End Fossil Fuels",https://www.breitbart.com/environment/2025/11/24/widespread-disappointment-as-u-n-climate-doom-summit-cop30-ends-with-lukewarm-roadmap/,2025-11-24,2025,11,2025-11,2025-11-24/2025-11-30,"COP30 Climate Summit Ends with 'Roadmap,' but No Vow, to End Fossil Fuels"
